{
  "$schema": "./tools.schema.json",
  "version": "1.0",
  "strict_returns": true,
  "redactionValue": "REDACTED",
  "categories": {
    "gp": {
      "label": "GP workflows",
      "summary": "Patient lookup + clinical primitives"
    },
    "appointments": {
      "label": "Appointments",
      "summary": "Schedule and roster primitives"
    },
    "billing": {
      "label": "Billing",
      "summary": "Invoice + patient debt primitives"
    },
    "admin": {
      "label": "Administration",
      "summary": "Practice dashboards"
    },
    "reception": {
      "label": "Reception staffing",
      "summary": "Reception-load calc: staffing vs demand per 10-min bucket per side"
    }
  },
  "tools": [
    {
      "tool_name": "get_dashboard_stats",
      "path": "/api/Dashboard/stats",
      "method": "GET",
      "category": "admin",
      "write": false,
      "description": "Dashboard metrics for the practice: total queries, success rate, average response time, active users, last query timestamp. Takes `days` (default 30) for the lookback window. No PII. Useful for 'how is the system performing' or 'what's our query throughput'.",
      "source": {},
      "parameters": {
        "days": {
          "type": "integer",
          "format": "int32",
          "required": false,
          "in": "query"
        }
      },
      "returns": {
        "success": {
          "type": "boolean",
          "pii": false
        },
        "data.totalQueriesExecuted": {
          "type": "integer",
          "pii": false,
          "format": "int32"
        },
        "data.successfulQueries": {
          "type": "integer",
          "pii": false,
          "format": "int32"
        },
        "data.failedQueries": {
          "type": "integer",
          "pii": false,
          "format": "int32"
        },
        "data.successRate": {
          "type": "number",
          "pii": false,
          "format": "double"
        },
        "data.averageResponseTimeMs": {
          "type": "number",
          "pii": false,
          "format": "double"
        },
        "data.totalReports": {
          "type": "integer",
          "pii": false,
          "format": "int32"
        },
        "data.activeUsers": {
          "type": "integer",
          "pii": false,
          "format": "int32"
        },
        "data.lastQueryExecuted": {
          "type": "string",
          "pii": false,
          "format": "date-time"
        },
        "data.queryTypeBreakdown.queryType": {
          "type": "string",
          "pii": false
        },
        "data.queryTypeBreakdown.count": {
          "type": "integer",
          "pii": false,
          "format": "int32"
        },
        "data.queryTypeBreakdown.percentage": {
          "type": "number",
          "pii": false,
          "format": "double"
        },
        "data.environmentBreakdown.environment": {
          "type": "string",
          "pii": false
        },
        "data.environmentBreakdown.count": {
          "type": "integer",
          "pii": false,
          "format": "int32"
        },
        "data.environmentBreakdown.percentage": {
          "type": "number",
          "pii": false,
          "format": "double"
        },
        "message": {
          "type": "string",
          "pii": false
        },
        "errorCode": {
          "type": "string",
          "pii": false
        },
        "timestamp": {
          "type": "string",
          "pii": false,
          "format": "date-time"
        },
        "requestId": {
          "type": "string",
          "pii": false
        }
      }
    },
    {
      "tool_name": "get_appointment_book",
      "path": "/api/Manpower/appointment-book/data",
      "method": "POST",
      "category": "appointments",
      "write": true,
      "description": "Fetch the appointment book (the schedule grid of all appointments across practitioners) for a given date and location. Returns rows with patient name/DOB/address/phones/reason (all REDACTED before you see them) plus the doctor name, slot time, and status. Use for questions like 'how busy is the Crace clinic today' or 'which appointments are running late' — but remember you cannot see patient identities; refer to them by internalId if you need to discuss a specific row.",
      "source": {},
      "parameters": {
        "siteId": {
          "type": "string",
          "required": false,
          "in": "body"
        },
        "subscriptionKey": {
          "type": "string",
          "required": false,
          "in": "body"
        },
        "useProduction": {
          "type": "boolean",
          "required": false,
          "in": "body"
        },
        "startDate": {
          "type": "string",
          "required": false,
          "in": "body"
        },
        "endDate": {
          "type": "string",
          "required": false,
          "in": "body"
        },
        "locationName": {
          "type": "string",
          "required": false,
          "in": "body"
        }
      },
      "returns": {
        "success": {
          "type": "boolean",
          "pii": false
        },
        "data.appointmentDate": {
          "type": "string",
          "pii": false,
          "format": "date-time"
        },
        "data.appointmentTime": {
          "type": "string",
          "pii": false
        },
        "data.appointmentLengthMins": {
          "type": "integer",
          "pii": false,
          "format": "int32"
        },
        "data.location": {
          "type": "string",
          "pii": false
        },
        "data.doctor": {
          "type": "string",
          "pii": false
        },
        "data.patientId": {
          "type": "integer",
          "pii": false,
          "format": "int32"
        },
        "data.patientName": {
          "type": "string",
          "pii": true
        },
        "data.dateOfBirth": {
          "type": "string",
          "pii": true,
          "format": "date-time"
        },
        "data.address": {
          "type": "string",
          "pii": true
        },
        "data.workPhone": {
          "type": "string",
          "pii": true
        },
        "data.homePhone": {
          "type": "string",
          "pii": true
        },
        "data.mobile": {
          "type": "string",
          "pii": true
        },
        "data.appointmentType": {
          "type": "string",
          "pii": false
        },
        "data.reason": {
          "type": "string",
          "pii": true
        },
        "message": {
          "type": "string",
          "pii": false
        },
        "errorCode": {
          "type": "string",
          "pii": false
        },
        "timestamp": {
          "type": "string",
          "pii": false,
          "format": "date-time"
        },
        "requestId": {
          "type": "string",
          "pii": false
        }
      }
    },
    {
      "tool_name": "list_practitioners_today",
      "path": "/api/Roster/today/{location}",
      "method": "GET",
      "category": "appointments",
      "write": false,
      "description": "List the practitioners rostered at a specific location today, with their department, shift times, and scheduled hours. Doctor/staff names ARE surfaced (not redacted — policy). Use this to answer 'who is working today' or 'which GPs are on at Lyneham this afternoon'.",
      "source": {},
      "parameters": {
        "location": {
          "type": "string",
          "required": true,
          "in": "path"
        }
      },
      "returns": {
        "success": {
          "type": "boolean",
          "pii": false
        },
        "data.scheduleId": {
          "type": "integer",
          "pii": false,
          "format": "int32"
        },
        "data.userId": {
          "type": "integer",
          "pii": false,
          "format": "int32"
        },
        "data.userName": {
          "type": "string",
          "pii": false
        },
        "data.departmentId": {
          "type": "integer",
          "pii": false,
          "format": "int32"
        },
        "data.departmentName": {
          "type": "string",
          "pii": false
        },
        "data.location": {
          "type": "string",
          "pii": false
        },
        "data.startTime": {
          "type": "string",
          "pii": false,
          "format": "date-time"
        },
        "data.finishTime": {
          "type": "string",
          "pii": false,
          "format": "date-time"
        },
        "data.startTimeFormatted": {
          "type": "string",
          "pii": false
        },
        "data.finishTimeFormatted": {
          "type": "string",
          "pii": false
        },
        "data.hoursScheduled": {
          "type": "number",
          "pii": false,
          "format": "double"
        },
        "data.acceptanceStatus": {
          "type": "string",
          "pii": false
        },
        "message": {
          "type": "string",
          "pii": false
        },
        "errorCode": {
          "type": "string",
          "pii": false
        },
        "timestamp": {
          "type": "string",
          "pii": false,
          "format": "date-time"
        },
        "requestId": {
          "type": "string",
          "pii": false
        }
      }
    },
    {
      "tool_name": "get_debt_aging_summary",
      "path": "/api/debt-collections/aging-summary",
      "method": "GET",
      "category": "billing",
      "write": false,
      "description": "Practice-wide aging summary: total debt, number of debtor patients, and number of unpaid invoices, broken down into buckets (0-30 days, 31-60, 61-90, 91-120, 121-180, 180+). No per-patient data — aggregate only. Optional `fromDate` and `minAmount` filters. Use for overview questions like 'what is our total outstanding AR' or 'how much is in the 180+ bucket.'",
      "source": {},
      "parameters": {
        "fromDate": {